"original_text","perturbed_text","original_score","perturbed_score","original_output","perturbed_output","ground_truth_output","num_queries","result_type"
"I think it's the [[sort]] of film you either [[love]] or hate and [[I'm]] really not the type to go in for arty movies. My mother rented ""[[mullhuland]] DR"" the other night and I nearly ran from the [[room]], ha. But I love this film.<br /><br />We recorded ""[[The]] Beat"" one night when we had just [[let]] the tape run and got a great film that way by accident. Saved that tape and watched it a lot. I eventually got the [[VHS]] to add to my collection. I've watched it many times and at one point copied down the [[poems]]. I even tried to preform one scene for my high school drama class. She had said we could do any scene we wanted and just cut out the bad words. [[She]] refused to let me do it. If it could upset my drama teacher that much it has to be good :) Honest she [[never]] treated me the same after that.<br /><br />I liked the [[acting]] it came off very true and [[honest]]. It wasn't clean and [[polished]] but it was better than that. It was true to life, how anyone would truly behave and display emotions not how [[Hollywood]] does. It was great acting especially by the [[one]] playing Rex.<br /><br />The story was original. Not only do the [[characters]] get [[drawn]] into his [[world]] but you do too. Not your typical person meets inner city kids and saves them through knowledge film at all. Simply [[caring]] and friendship make things a bit better.<br /><br />[[The]] only [[thing]] is that even in the 80's there was more gun violence and less simple stuff like [[rock]] throwing but that little bit of [[innocence]] didn't hurt this film.<br /><br />I think it's a must [[see]]. you will either [[love]] or hate it but either way it makes an impact and that makes a good film that you will remember and talk about later.","I think it's the [[soZrt]] of film you either [[lov]] or hate and [[Iem]] really not the type to go in for arty movies. My mother rented ""[[mlulhuland]] DR"" the other night and I nearly ran from the [[rom]], ha. But I love this film.<br /><br />We recorded ""[[Th]] Beat"" one night when we had just [[elt]] the tape run and got a great film that way by accident. Saved that tape and watched it a lot. I eventually got the [[HS]] to add to my collection. I've watched it many times and at one point copied down the [[poeKms]]. I even tried to preform one scene for my high school drama class. She had said we could do any scene we wanted and just cut out the bad words. [[Se]] refused to let me do it. If it could upset my drama teacher that much it has to be good :) Honest she [[nevQr]] treated me the same after that.<br /><br />I liked the [[atting]] it came off very true and [[hoxest]]. It wasn't clean and [[poliTshed]] but it was better than that. It was true to life, how anyone would truly behave and display emotions not how [[Hollywuod]] does. It was great acting especially by the [[okne]] playing Rex.<br /><br />The story was original. Not only do the [[charactres]] get [[draxn]] into his [[jorld]] but you do too. Not your typical person meets inner city kids and saves them through knowledge film at all. Simply [[carnig]] and friendship make things a bit better.<br /><br />[[Te]] only [[thng]] is that even in the 80's there was more gun violence and less simple stuff like [[rok]] throwing but that little bit of [[inocence]] didn't hurt this film.<br /><br />I think it's a must [[oee]]. you will either [[lovPe]] or hate it but either way it makes an impact and that makes a good film that you will remember and talk about later.",0.00014781951904296875,0.0005399584770202637,1,1,1,318,"Failed"
"It's not awful but what a waste... Lousy [[gags]], bad music, [[poor]] drawings and animation...<br /><br />Regarding the impressive number of animators and intervallists on this picture (from, hum... a hundred different studios throughout the [[world]]? Come on, how can you expect something coherent when doing an animated movie this way!) I [[wonder]] if one guy on the credits = one drawing! [[The]] lines are [[rough]], the 3d work inadequate (I'm not against it, but not in this film) But the backgrounds are corrects. [[The]] storyline is [[rather]] dumb, far from the precise cleverness of the BD, and obviously aimed at an [[international]] [[audience]]. [[To]] distribute a movie all over the world doesn't mean to take [[everyone]] in the world for a simple-minded guy... A cultural object is far more interesting when challenging, even when it is a foreign movie (being french in this case it's [[even]] worse!).<br /><br />Some new stuff is doing well (the Olaf character, sometimes, like with the stone explanation, but it's not great) but the modern references are [[exasperating]] (music, [[SMS]] -not even a verbal joke, just a stupid bird named short message service: does anyone know imagination?). But, hey, it's a M6 / TPS [[production]] with some Celine Dion in it... pathetic.<br /><br />Asterix is underemployed and [[Obelix]] talks too much. Goudurix could be great (like in the book) but he is too clearly a ""cool guy"" having a love [[affair]] (with an uninteresting made up female character). [[In]] [[fact]], only the [[vikings]] (wizard excepted) are funny. [[Too]] [[much]] [[action]], not enough laughs. The best part of the movie are the end credits. Not the music, but the few stills it contains. BD style. Well, definitely, Asterix is not [[made]] to [[move]]!","It's not awful but what a waste... Lousy [[gag]], bad music, [[por]] drawings and animation...<br /><br />Regarding the impressive number of animators and intervallists on this picture (from, hum... a hundred different studios throughout the [[Xorld]]? Come on, how can you expect something coherent when doing an animated movie this way!) I [[wonAder]] if one guy on the credits = one drawing! [[he]] lines are [[ough]], the 3d work inadequate (I'm not against it, but not in this film) But the backgrounds are corrects. [[he]] storyline is [[arther]] dumb, far from the precise cleverness of the BD, and obviously aimed at an [[intrenational]] [[audienwe]]. [[T]] distribute a movie all over the world doesn't mean to take [[eevryone]] in the world for a simple-minded guy... A cultural object is far more interesting when challenging, even when it is a foreign movie (being french in this case it's [[eve]] worse!).<br /><br />Some new stuff is doing well (the Olaf character, sometimes, like with the stone explanation, but it's not great) but the modern references are [[exaspherating]] (music, [[MS]] -not even a verbal joke, just a stupid bird named short message service: does anyone know imagination?). But, hey, it's a M6 / TPS [[proiuction]] with some Celine Dion in it... pathetic.<br /><br />Asterix is underemployed and [[Pbelix]] talks too much. Goudurix could be great (like in the book) but he is too clearly a ""cool guy"" having a love [[affai]] (with an uninteresting made up female character). [[n]] [[afct]], only the [[vikigs]] (wizard excepted) are funny. [[oo]] [[mvuch]] [[actBon]], not enough laughs. The best part of the movie are the end credits. Not the music, but the few stills it contains. BD style. Well, definitely, Asterix is not [[madS]] to [[Eove]]!",0.00017601251602172852,0.00027698278427124023,0,0,0,394,"Failed"
"CRY FREEDOM is an [[excellent]] [[primer]] for those wanting an overview of apartheid's cruelty in just a couple of hours. Famed director Richard Attenborough (GANDHI) is certainly no stranger to the genre, and the collaboration of the real-life Mr. and Mrs. Woods, the main white characters in their book and in this film, lends further authenticity to CRY FREEDOM. [[The]] video now in release actually runs a little over 2 and a half hours since 23 minutes of extra footage was inserted to make it a two part TV miniseries after the film's initial theatrical release. While the added length serves to heighten the film's forgivable flaws: uneven character development and blanket stereotyping in particular, another possible flaw (the insistence on the white characters' fate over that of the African ones) may work out as a strength. Viewing CRYING FREEDOM as a politically and historically educational film (as I think it should, over its artistic merits), the story is one which black Africans know only too well, though the younger generation may now need to see it on film for full impact. It is the whites who have always been the film's and the book's target audience, hopefully driving them to change. Now twelve years after the movie's production, CRY FREEDOM is in [[many]] ways a more [[interesting]] [[film]] to watch. Almost ten years after black majority rule has been at least theorically in place, 1987's CRY FREEDOM's ideals remain by and large unrealized. It therefore remains as imperative as ever for white South Africans, particularly the younger ones who have only heard of these actions to see it, and [[absorb]] the film's [[messages]]. In total contrast to American slavery and the Jewish Holocaust's exposure, South Africans' struggles have been told by a mere two or three stories: CRY FREEDOM, CRY THE BELOVED COUNTRY (OK, Count it twice if you include the remake), and SARAFINA (did I miss one?). All three [[dramas]] also clumsily feature American and British actors in both the white and black roles. Not one South African actor has played a major role, white, coloured, Indian or Black!). And [[yes]] I did miss another international South African drama, MANDELA and DEKLERK. Though this (also highly recommended) [[biopic]] was released after black majority rule was instituted, MANDELA was played by a Black American (Sidney Poitier, who also starred in the original S.A.-themed CRY THE BELOVED COUNTRY), while the Afrikaner DeKlerk was played by a (bald) very British Michael Caine, a good performance if you can dismiss that the very essence of Afrikanerdom is vehement anti-British feelings. Until local SABC TV and African films start dealing with their own legacy, CRY FREEDOM is about as authentic as you'll get. As villified as the whites (particularly the Afrikaners) are portrayed in the film, any observant (non-casual) visitor to South Africa even now in 1999, not to mention 1977 when CRY FREEDOM takes place, will generally find white's attitudes towards blacks restrained, even understated. Looking at CRY FREEDOM in hindsight, it is amazing that reconciliation can take place at all, and it is. But CRY FREEDOM at time shows not much has really changed in many people's minds yet, and that the Black Africans' goal to FREEDOM and reconciliation is still ongoing. This is why if you're a novice to the situation, CRY FREEDOM, is your best introduction.","CRY FREEDOM is an [[excelleAt]] [[pricer]] for those wanting an overview of apartheid's cruelty in just a couple of hours. Famed director Richard Attenborough (GANDHI) is certainly no stranger to the genre, and the collaboration of the real-life Mr. and Mrs. Woods, the main white characters in their book and in this film, lends further authenticity to CRY FREEDOM. [[he]] video now in release actually runs a little over 2 and a half hours since 23 minutes of extra footage was inserted to make it a two part TV miniseries after the film's initial theatrical release. While the added length serves to heighten the film's forgivable flaws: uneven character development and blanket stereotyping in particular, another possible flaw (the insistence on the white characters' fate over that of the African ones) may work out as a strength. Viewing CRYING FREEDOM as a politically and historically educational film (as I think it should, over its artistic merits), the story is one which black Africans know only too well, though the younger generation may now need to see it on film for full impact. It is the whites who have always been the film's and the book's target audience, hopefully driving them to change. Now twelve years after the movie's production, CRY FREEDOM is in [[any]] ways a more [[inteersting]] [[filvm]] to watch. Almost ten years after black majority rule has been at least theorically in place, 1987's CRY FREEDOM's ideals remain by and large unrealized. It therefore remains as imperative as ever for white South Africans, particularly the younger ones who have only heard of these actions to see it, and [[aborb]] the film's [[message]]. In total contrast to American slavery and the Jewish Holocaust's exposure, South Africans' struggles have been told by a mere two or three stories: CRY FREEDOM, CRY THE BELOVED COUNTRY (OK, Count it twice if you include the remake), and SARAFINA (did I miss one?). All three [[damas]] also clumsily feature American and British actors in both the white and black roles. Not one South African actor has played a major role, white, coloured, Indian or Black!). And [[es]] I did miss another international South African drama, MANDELA and DEKLERK. Though this (also highly recommended) [[biopi]] was released after black majority rule was instituted, MANDELA was played by a Black American (Sidney Poitier, who also starred in the original S.A.-themed CRY THE BELOVED COUNTRY), while the Afrikaner DeKlerk was played by a (bald) very British Michael Caine, a good performance if you can dismiss that the very essence of Afrikanerdom is vehement anti-British feelings. Until local SABC TV and African films start dealing with their own legacy, CRY FREEDOM is about as authentic as you'll get. As villified as the whites (particularly the Afrikaners) are portrayed in the film, any observant (non-casual) visitor to South Africa even now in 1999, not to mention 1977 when CRY FREEDOM takes place, will generally find white's attitudes towards blacks restrained, even understated. Looking at CRY FREEDOM in hindsight, it is amazing that reconciliation can take place at all, and it is. But CRY FREEDOM at time shows not much has really changed in many people's minds yet, and that the Black Africans' goal to FREEDOM and reconciliation is still ongoing. This is why if you're a novice to the situation, CRY FREEDOM, is your best introduction.",0.00016117095947265625,0.7150468826293945,1,0,1,403,"Successful"
"I did not have too much interest in watching The Flock.Andrew Lau co-directed the masterpiece trilogy of Infernal Affairs but he had been fired from The Flock and he had been replaced by an emergency director called Niels Mueller.I had the feeling that Lau had made a good film but it had not satisfied the study,so they fired him and hired another director.This [[usually]] does not work well (let's remember The Invasion).But The Flock resulted to be better than what I expected.It's not a great film but it's an interesting and entertaining thriller.The character development is very well done and I could know the characters very well.Also,the relationship between the two main characters is natural and credible.Richard Gere and Claire [[Danes]] bring competent performances.Now,let's go to the negative points.One element which really bothered me (there was a moment in which it irritated me) was the excess of edition tricks to give the movie more ""attitude"" and style.That tricks feel out of place and their presence is arbitrary.Plus,I think the film should have been more ambitious.In spite of that,I [[recommend]] The [[Flock]] as a [[good]] thriller.It's not memorable at all,but it's entertaining.","I did not have too much interest in watching The Flock.Andrew Lau co-directed the masterpiece trilogy of Infernal Affairs but he had been fired from The Flock and he had been replaced by an emergency director called Niels Mueller.I had the feeling that Lau had made a good film but it had not satisfied the study,so they fired him and hired another director.This [[usuallH]] does not work well (let's remember The Invasion).But The Flock resulted to be better than what I expected.It's not a great film but it's an interesting and entertaining thriller.The character development is very well done and I could know the characters very well.Also,the relationship between the two main characters is natural and credible.Richard Gere and Claire [[Dane]] bring competent performances.Now,let's go to the negative points.One element which really bothered me (there was a moment in which it irritated me) was the excess of edition tricks to give the movie more ""attitude"" and style.That tricks feel out of place and their presence is arbitrary.Plus,I think the film should have been more ambitious.In spite of that,I [[reommend]] The [[Flofk]] as a [[gooW]] thriller.It's not memorable at all,but it's entertaining.",0.00020200014114379883,0.6096564531326294,1,0,1,144,"Successful"
"I have this movie on a collection of inexpensive B-movies. It's not restored, in fact, the audio was difficult to discern for the first few minutes.<br /><br />At first, it seemed like a typical haunted house film, and feels very much like the forerunner of Clue, Murder by Death, House on Haunted Hill, etc.<br /><br />About a half hour into the film, the [[storyline]] takes a really [[interesting]] [[twist--and]] it goes from being a cliché melodrama to something entirely [[different]], and [[far]] more entertaining than I had initially thought.<br /><br />Check it out, it's a great deal of fun, even if the long clips and wider shots (and near lack of music score) make it feel a [[bit]] creaky by [[today's]] standards.","I have this movie on a collection of inexpensive B-movies. It's not restored, in fact, the audio was difficult to discern for the first few minutes.<br /><br />At first, it seemed like a typical haunted house film, and feels very much like the forerunner of Clue, Murder by Death, House on Haunted Hill, etc.<br /><br />About a half hour into the film, the [[storlyine]] takes a really [[intxresting]] [[twits--and]] it goes from being a cliché melodrama to something entirely [[diffeMrent]], and [[fZar]] more entertaining than I had initially thought.<br /><br />Check it out, it's a great deal of fun, even if the long clips and wider shots (and near lack of music score) make it feel a [[bSit]] creaky by [[todOy's]] standards.",0.0003305673599243164,0.9985072016716003,1,0,1,105,"Successful"
