"original_text","perturbed_text","original_score","perturbed_score","original_output","perturbed_output","ground_truth_output","num_queries","result_type"
"Except for the Brady Variety Hour, this was some of the [[hokiest]] television I've seen in a while. The video production qualities weren't too bad, but the overall look and feel were unmistakeably early 80's. And Marie Osmond looks like she did battle with the Avon Lady.. and lost big time. WAY too much eyeliner.<br /><br />It was kind of embarrassing to watch veterans Danny Kaye and Eric Severeid take part in this. Even more interesting was watching Alex Haley talk about the African Pavillion in World Showcase that would be opening 'in about a year.'<br /><br />[[As]] of this writing it is 17 years later and it hasn't opened yet (Unless you count Disney's Animal Kingdom.) All in all [[though]], for all the shortcomings, this still an interesting visual piece of Disney [[history]].","Except for the Brady Variety Hour, this was some of the [[hokPest]] television I've seen in a while. The video production qualities weren't too bad, but the overall look and feel were unmistakeably early 80's. And Marie Osmond looks like she did battle with the Avon Lady.. and lost big time. WAY too much eyeliner.<br /><br />It was kind of embarrassing to watch veterans Danny Kaye and Eric Severeid take part in this. Even more interesting was watching Alex Haley talk about the African Pavillion in World Showcase that would be opening 'in about a year.'<br /><br />[[sA]] of this writing it is 17 years later and it hasn't opened yet (Unless you count Disney's Animal Kingdom.) All in all [[thoubh]], for all the shortcomings, this still an interesting visual piece of Disney [[hitory]].",0.00030112266540527344,0.5040644407272339,0,1,0,99,"Successful"
"There is a DVD published in the UK in 2002 Code [[HRGD002]] on the cover, no ASIN, VFC 19796 on the disk, no IFPI code in the inner rim.<br /><br />Probably a straight transfer from VHS. <br /><br />There is no [[much]] point is commenting an adult film. But this [[one]] contains a minimal plot, and the characters are believable. It was shown in the United States in [[normal]] cinemas.<br /><br />I've seen it In Pensylvannia way back in 1975.<br /><br />As such it deserves a place in an Encyclopedia of Movies. The DVD has no special features and no subtitles, and was probably made using a VHS tape as source","There is a DVD published in the UK in 2002 Code [[HRGD0B02]] on the cover, no ASIN, VFC 19796 on the disk, no IFPI code in the inner rim.<br /><br />Probably a straight transfer from VHS. <br /><br />There is no [[umch]] point is commenting an adult film. But this [[onQe]] contains a minimal plot, and the characters are believable. It was shown in the United States in [[nomral]] cinemas.<br /><br />I've seen it In Pensylvannia way back in 1975.<br /><br />As such it deserves a place in an Encyclopedia of Movies. The DVD has no special features and no subtitles, and was probably made using a VHS tape as source",0.005887448787689209,0.7741718888282776,0,1,0,87,"Successful"
"""The seventh sign"" borrows a lot from ""Rosemary's baby"" and ""the omen"" (it actually blends the two stories).Even its title recalls Bergman' s ""the seventh seal"" .<br /><br />[[Nevertheless]],it [[begins]] well enough,with all the omens scattered on the whole earth,and in parallel ,a -seemingly- distinct plot with Moore's husband trying to save a poor boy (who killed his parents who were brother and sister)from death penalty.This time,both Christian and Jewish religions are called to the rescue (even the Wandering Jew is involved),which makes the lines sometimes unintentionally [[funny]] (Have you ever been to Sunday school? But they taught me that God was love!).The best scene IMHO ,is the short dialog between priest John Heard -who does not seem to take things seriously ,too bad he was not given a more important part because his laid-back acting is priceless-and the young Jew.<br /><br />Demi Moore probably registered the same desire as ex-husband Bruce Willis :saving the world.She does not save the [[movie]] for all that.","""The seventh sign"" borrows a lot from ""Rosemary's baby"" and ""the omen"" (it actually blends the two stories).Even its title recalls Bergman' s ""the seventh seal"" .<br /><br />[[Nevertheles]],it [[becins]] well enough,with all the omens scattered on the whole earth,and in parallel ,a -seemingly- distinct plot with Moore's husband trying to save a poor boy (who killed his parents who were brother and sister)from death penalty.This time,both Christian and Jewish religions are called to the rescue (even the Wandering Jew is involved),which makes the lines sometimes unintentionally [[ufnny]] (Have you ever been to Sunday school? But they taught me that God was love!).The best scene IMHO ,is the short dialog between priest John Heard -who does not seem to take things seriously ,too bad he was not given a more important part because his laid-back acting is priceless-and the young Jew.<br /><br />Demi Moore probably registered the same desire as ex-husband Bruce Willis :saving the world.She does not save the [[Govie]] for all that.",0.0003682374954223633,0.7011528015136719,0,1,0,130,"Successful"
"A remake can be successful. An adaptation can be successful. It isn't relevant whether its a remake or an adaptation.<br /><br />A good movie is a good movie and a poor movie is a poor movie, regardless.<br /><br />Sarkar, I am afraid, was a very poor movie. [[First]] of all, just by making characters look dangerous, or [[macho]], they don't [[bring]] in an aura about them.<br /><br />[[What]] was so brilliant about Nagre(Amitabh [[Bacchan's]] character) that we should have been in aura of his 'power' and what showed the '[[benevolence']] of the character? [[Nothing]].<br /><br />This fact was said by a commentator and Amitabh kept giving [[facial]] expressions. Now [[Amitabh]] can [[give]] brilliant facial [[expressions]] but why should it mean any thing if there is no history or story to go with it.<br /><br />There wasn't proper [[charecterisation]] of the characters who worked under 'sarkar' too. Just because a man had spectacles, why should we assume he is wise. ] The [[flow]] of the movie was generally [[dullbecause]] scenes from the Godfather were created (like the policeman slapping Abhishek Bacchan), the older brother being killed by [[Abhishek]] (like Fredo was killed on instructions of Pacino) but too much was sought to be packed into the movie with too little story and depth to go with it. That was indeed the [[problem]].<br /><br />If you try to pack 3 hours of intricate detail like a Godfather in 2 hours and that too with few dialogues, what you get is a highlights show from a cricket match, [[never]] making the full impact watching a full match will make.","A remake can be successful. An adaptation can be successful. It isn't relevant whether its a remake or an adaptation.<br /><br />A good movie is a good movie and a poor movie is a poor movie, regardless.<br /><br />Sarkar, I am afraid, was a very poor movie. [[Fist]] of all, just by making characters look dangerous, or [[maho]], they don't [[bing]] in an aura about them.<br /><br />[[hat]] was so brilliant about Nagre(Amitabh [[Bacchpn's]] character) that we should have been in aura of his 'power' and what showed the '[[benevolenceP]] of the character? [[Nothtng]].<br /><br />This fact was said by a commentator and Amitabh kept giving [[fcial]] expressions. Now [[Amiabh]] can [[gve]] brilliant facial [[expresssions]] but why should it mean any thing if there is no history or story to go with it.<br /><br />There wasn't proper [[chaEecterisation]] of the characters who worked under 'sarkar' too. Just because a man had spectacles, why should we assume he is wise. ] The [[lfow]] of the movie was generally [[duLllbecause]] scenes from the Godfather were created (like the policeman slapping Abhishek Bacchan), the older brother being killed by [[AbhisVek]] (like Fredo was killed on instructions of Pacino) but too much was sought to be packed into the movie with too little story and depth to go with it. That was indeed the [[problsem]].<br /><br />If you try to pack 3 hours of intricate detail like a Godfather in 2 hours and that too with few dialogues, what you get is a highlights show from a cricket match, [[enver]] making the full impact watching a full match will make.",0.00018900632858276367,0.5992670059204102,0,1,0,231,"Successful"
"""Rich in Love"" is a slice-of-life film which takes the viewer into the goings on of a somewhat quirky Charleston, SC family. Highly [[romanticized]], beautifully shot, well written and acted, ""RIL"" washes over you like a summer breeze as its plotless meandering breathes life into the characters such that at film's end you'll feel like an old [[friend]] of the family.<br /><br />A [[wonderfully]] crafted [[character-driven]] [[film]] from the director of ""Driving [[Miss]] Daisy"", ""[[RIL]]"" is a [[somewhat]] [[obscure]] little ""sleeper"" which will [[appeal]] most to [[mature]] audiences.","""Rich in Love"" is a slice-of-life film which takes the viewer into the goings on of a somewhat quirky Charleston, SC family. Highly [[lromanticized]], beautifully shot, well written and acted, ""RIL"" washes over you like a summer breeze as its plotless meandering breathes life into the characters such that at film's end you'll feel like an old [[firend]] of the family.<br /><br />A [[wonderfuqly]] crafted [[ctaracter-driven]] [[filbm]] from the director of ""Driving [[Mss]] Daisy"", ""[[RLI]]"" is a [[somwhat]] [[obscurO]] little ""sleeper"" which will [[lappeal]] most to [[cature]] audiences.",0.0001329183578491211,0.7047908902168274,1,0,1,118,"Successful"
"How can Barry Levinson possibly assemble white-hot [[comedy]] [[talents]] [[Ben]] Stiller and Jack Black, the gorgeous Rachel [[Weisz]], old pro Christopher Walken and still [[deliver]] such a humourless stinker?<br /><br />Stiller and Black are [[friends]] until the latter invents a spray to make dog mess vanish and becomes a conspicuous consuming multi-millionaire.<br /><br />[[The]] premises is thin but sound [[enough]] in the right hands to have been a springboard for some great bitching between the two [[stars]] but all concerned overplay every hand, every [[chance]] they can.<br /><br />Stiller and Black are simply not [[funny]] for way too much of the time, Weisz looks sensational as always but is criminally underused and, with the exception of Walken as a batty barfly who [[urges]] Stiller's character to [[take]] revenge, it's a [[turgid]] trudge to the end of this strained farce.","How can Barry Levinson possibly assemble white-hot [[Zomedy]] [[taleAts]] [[en]] Stiller and Jack Black, the gorgeous Rachel [[Wesiz]], old pro Christopher Walken and still [[deliKver]] such a humourless stinker?<br /><br />Stiller and Black are [[fbriends]] until the latter invents a spray to make dog mess vanish and becomes a conspicuous consuming multi-millionaire.<br /><br />[[Te]] premises is thin but sound [[enouh]] in the right hands to have been a springboard for some great bitching between the two [[tars]] but all concerned overplay every hand, every [[chVance]] they can.<br /><br />Stiller and Black are simply not [[fuSnny]] for way too much of the time, Weisz looks sensational as always but is criminally underused and, with the exception of Walken as a batty barfly who [[urgVes]] Stiller's character to [[ake]] revenge, it's a [[tuergid]] trudge to the end of this strained farce.",0.00025981664657592773,0.5412038564682007,0,1,0,180,"Successful"
"[[The]] 1986 TV movie of [[The]] Spirit was a pilot for a possible series. However, Spirit creator [[Will]] Eisner did not like the film and thus no series was produced. I thought it was a very entertaining film and [[captured]] the spirit (sorry) of the comic with a modern twist. I'm sorry it didn't materialize into a series. Sam (Flash Gordon) [[Jones]] was a [[perfect]] Spirit. Nana Visitor was a nice Ellen [[Dolan]] and of course would later go on to [[Star]] Trek:Deep Space Nine years later. Maybe with the release of Frank Miller's big-screen [[version]] of The Spirit, more people will be able to see this rare gem of Spirit history. It seems that when Hollywood makes a [[film]] from an already established character or idea, someone will [[inevitably]] [[seek]] out previous versions of the [[property]] and release it to video in order to make a few dollars. When Antonio [[Banderas]] donned the mask of Zorro, we were able to [[get]] [[earlier]] versions of the [[masked]] [[hero]] on [[DVD]], such as the great [[Alain]] [[Delon]] version of the 1970s (although all copies I ever [[saw]] were badly edited). [[Heres]] [[hoping]] someone will release the TV adventure of [[The]] Spirit to [[DVD]] soon.","[[hTe]] 1986 TV movie of [[he]] Spirit was a pilot for a possible series. However, Spirit creator [[xill]] Eisner did not like the film and thus no series was produced. I thought it was a very entertaining film and [[captuerd]] the spirit (sorry) of the comic with a modern twist. I'm sorry it didn't materialize into a series. Sam (Flash Gordon) [[Jonas]] was a [[prefect]] Spirit. Nana Visitor was a nice Ellen [[DolLn]] and of course would later go on to [[Sar]] Trek:Deep Space Nine years later. Maybe with the release of Frank Miller's big-screen [[vercsion]] of The Spirit, more people will be able to see this rare gem of Spirit history. It seems that when Hollywood makes a [[filv]] from an already established character or idea, someone will [[inevUitably]] [[see]] out previous versions of the [[proerty]] and release it to video in order to make a few dollars. When Antonio [[Bandras]] donned the mask of Zorro, we were able to [[ge]] [[earlir]] versions of the [[mased]] [[heor]] on [[DD]], such as the great [[Alan]] [[Deloy]] version of the 1970s (although all copies I ever [[aw]] were badly edited). [[HeTres]] [[hping]] someone will release the TV adventure of [[he]] Spirit to [[xVD]] soon.",0.000277101993560791,0.002680361270904541,1,1,1,486,"Failed"
"So often a band will get together for a re-union concert only to find that they just [[can't]] get it together. [[Not]] so here. This [[concert]] is just shear brilliance from start to finish. These three [[musicians]] [[obviously]] [[got]] [[together]] beforehand and plotted and [[planned]] what was [[needed]] to ensure this was not just a nostalgic bash to satisfy someone's ego. [[This]] is obvious from the start, before they even step on [[stage]]. [[Many]] faces in the crowd weren't even born when these guys [[first]] performed. From the first song they capture that [[old]] [[magic]] that was Cream, 3 men, 3 instruments, no fuss. Clapton, by his own admission, said he had to stretch himself for this concert because there were no keyboards, synthesizers [[etc]] so we get to [[see]] him at his [[best]]. Ginger Baker demonstrates why so many drummers today, speak of him as some sort of drumming guru. Jack Bruce just [[great]]. They really managed to [[put]] [[together]] a [[piece]] of magic that will stand the test of [[time]] for many [[years]] to come. [[This]] one's a 10 for me.","So often a band will get together for a re-union concert only to find that they just [[can'h]] get it together. [[No]] so here. This [[vconcert]] is just shear brilliance from start to finish. These three [[musiciZans]] [[obveiously]] [[gut]] [[ogether]] beforehand and plotted and [[plnned]] what was [[neded]] to ensure this was not just a nostalgic bash to satisfy someone's ego. [[Tis]] is obvious from the start, before they even step on [[sMtage]]. [[any]] faces in the crowd weren't even born when these guys [[tfirst]] performed. From the first song they capture that [[od]] [[amgic]] that was Cream, 3 men, 3 instruments, no fuss. Clapton, by his own admission, said he had to stretch himself for this concert because there were no keyboards, synthesizers [[eetc]] so we get to [[xee]] him at his [[mbest]]. Ginger Baker demonstrates why so many drummers today, speak of him as some sort of drumming guru. Jack Bruce just [[reat]]. They really managed to [[pRut]] [[togethex]] a [[vpiece]] of magic that will stand the test of [[tiVme]] for many [[yeans]] to come. [[Thi]] one's a 10 for me.",0.0002841353416442871,0.6431649923324585,1,0,1,213,"Successful"
"Alexander Nevsky (1938) is a [[brilliant]] [[piece]] of cinematic propaganda. [[The]] people of [[Russia]] are [[threatened]] by two major enemies, the Mongols and the Teutonic Knights of the Holy Roman Empire. In ordered to unite the warring, rival Princes in the Russian Realm, Nevsky takes charge and fights the lesser of two evils (The Teutonics). This influential film was copied many times over and it still holds up to this day. The soundtrack by composer [[Prokiev]] and Eisentstein's [[direction]] are a sight and sound to behold Many years later, John Milius used [[many]] of the movies scenes, set [[pieces]] and costumes from this film and incorporated them into Conan.<br /><br />One of my favorite lines from Conan was [[taken]] from this movie. ""It's not the strength of the iron in a weapon but the strength of the person that wields it is what [[matters]]."" The [[comparisons]] are [[unmistakable]]. The armor that James Earl Jones and the Leader of the Teutonic Knights wear are [[virtually]] [[identical]]. A [[true]] [[tribute]] paid from one [[director]] to another.<[[br]] /><[[br]] />I give Alexander Nevsky one of my [[highest]] [[recommendations]]. The movie plays like the [[final]] Act of Richard III. The presence of Prince Alexander on the screen is truly amazing.","Alexander Nevsky (1938) is a [[brillint]] [[ipece]] of cinematic propaganda. [[Teh]] people of [[lussia]] are [[threaetned]] by two major enemies, the Mongols and the Teutonic Knights of the Holy Roman Empire. In ordered to unite the warring, rival Princes in the Russian Realm, Nevsky takes charge and fights the lesser of two evils (The Teutonics). This influential film was copied many times over and it still holds up to this day. The soundtrack by composer [[Prokie]] and Eisentstein's [[direcztion]] are a sight and sound to behold Many years later, John Milius used [[may]] of the movies scenes, set [[pqeces]] and costumes from this film and incorporated them into Conan.<br /><br />One of my favorite lines from Conan was [[taen]] from this movie. ""It's not the strength of the iron in a weapon but the strength of the person that wields it is what [[Katters]]."" The [[omparisons]] are [[unmisYtakable]]. The armor that James Earl Jones and the Leader of the Teutonic Knights wear are [[virtualy]] [[iedntical]]. A [[tre]] [[qtribute]] paid from one [[idrector]] to another.<[[rb]] /><[[rb]] />I give Alexander Nevsky one of my [[tighest]] [[Grecommendations]]. The movie plays like the [[inal]] Act of Richard III. The presence of Prince Alexander on the screen is truly amazing.",0.0002681612968444824,0.006933331489562988,1,1,1,243,"Failed"
"Criminals Perry Smith and Richard ""Dick"" Hickock believe Mr. Clutter of Holcomb, Kansas keeps a large supply of cash on-hand in a safe.On November 15, 1959 at two a.m. they end up murdering Mr. and Mrs. Clutter and their teenage son and daughter.After a little police investigation the two men are found and sentenced to be hanged.In Cold Blood (1967) is directed by Richard Brooks.Now, I haven't read the Truman Capote novel this movie is based on, so I can't make any [[comparisons]].The [[movie]] does a [[brilliant]] [[job]] [[telling]] of those horrific [[events]] that actually took place.Robert Blake is excellent as Perry.Of course, Blake had the murder case of his own a few years back, being accused of murdering his wife.He's free now, but we still don't know the truth.What ever that may be, he's still a very fine actor.Scott Wilson does remarkable job as Hickock.John Forsythe is terrific as Alvin Dewey.Paul Stewart is very good as Jensen.Jeff Corey is marvelous as Mr. Hickock.Same thing with Charles McGraw who plays Tex Smith.John McLiam portrays Herbert Clutter, Ruth Storey is his wife Bonnie, Brenda Currin is the daughter Nancy and Paul Hough is the son Kenyon.Great job by each of them.There is much to remember from this film.Let's start from the lighter side.It's pretty great when Perry wants to go hunting for gold in Mexico and says to Hickock: Remember Bogart in Treasure of the Sierra Madre?"" And Blake himself was in that movie as a boy! And it's a fun moment when they, giving a ride to that boy and his granddad, collect bottles and turn them in for refund money.Those darker moments are the most haunting ones.The flashback sequence, where you see the murders happening, is extremely terrifying.When Perry goes to kill the girl, Nancy last, and she says ""Oh, please, don't""...The brutality of man, it's impossible to explain.Then the hanging scene.First there goes Hickock and then Perry, first talking to the minister.In the last image of the movie we see Perry hitting the end of the rope.Sure movies,and books may try to sympathize these villains.Especially Perry's character is someone you could feel sorry for.He thinks of his mom, and dad who he hates, but still loves.But it doesn't change the fact both of these men these actors portray are brutal murderers, who don't feel sorry for anybody.They go to this house and murder an entire family, in cold blood.How could you sympathize these people?","Criminals Perry Smith and Richard ""Dick"" Hickock believe Mr. Clutter of Holcomb, Kansas keeps a large supply of cash on-hand in a safe.On November 15, 1959 at two a.m. they end up murdering Mr. and Mrs. Clutter and their teenage son and daughter.After a little police investigation the two men are found and sentenced to be hanged.In Cold Blood (1967) is directed by Richard Brooks.Now, I haven't read the Truman Capote novel this movie is based on, so I can't make any [[comprisons]].The [[movei]] does a [[brillialnt]] [[Vjob]] [[telqing]] of those horrific [[Zevents]] that actually took place.Robert Blake is excellent as Perry.Of course, Blake had the murder case of his own a few years back, being accused of murdering his wife.He's free now, but we still don't know the truth.What ever that may be, he's still a very fine actor.Scott Wilson does remarkable job as Hickock.John Forsythe is terrific as Alvin Dewey.Paul Stewart is very good as Jensen.Jeff Corey is marvelous as Mr. Hickock.Same thing with Charles McGraw who plays Tex Smith.John McLiam portrays Herbert Clutter, Ruth Storey is his wife Bonnie, Brenda Currin is the daughter Nancy and Paul Hough is the son Kenyon.Great job by each of them.There is much to remember from this film.Let's start from the lighter side.It's pretty great when Perry wants to go hunting for gold in Mexico and says to Hickock: Remember Bogart in Treasure of the Sierra Madre?"" And Blake himself was in that movie as a boy! And it's a fun moment when they, giving a ride to that boy and his granddad, collect bottles and turn them in for refund money.Those darker moments are the most haunting ones.The flashback sequence, where you see the murders happening, is extremely terrifying.When Perry goes to kill the girl, Nancy last, and she says ""Oh, please, don't""...The brutality of man, it's impossible to explain.Then the hanging scene.First there goes Hickock and then Perry, first talking to the minister.In the last image of the movie we see Perry hitting the end of the rope.Sure movies,and books may try to sympathize these villains.Especially Perry's character is someone you could feel sorry for.He thinks of his mom, and dad who he hates, but still loves.But it doesn't change the fact both of these men these actors portray are brutal murderers, who don't feel sorry for anybody.They go to this house and murder an entire family, in cold blood.How could you sympathize these people?",0.00013720989227294922,0.9782696962356567,1,0,1,303,"Successful"
"Dude...I [[liked]] Buffy and Angel as much as the [[next]] [[sci-fi]] freak...but this is too much. The worst lead [[actress]] [[EVER]]!! Not even David ""Hot Pants"" Boreanaz is able to save this crap. No [[wonder]] I NEVER watch [[Fox]]  it blows!! [[We]] totally [[gave]] it a [[chance]], and it [[continued]] to suck. We watched [[four]] or [[five]] painful, agonizing [[episodes]]. I want to kill the [[execs]] at the network SO BAD! [[Why]] is [[money]] being spent on this [[drivel]]?!?! I don't get it and I don't support it and you should [[NEVER]] waste your [[time]] watching this show...unless you [[LIKE]] it when your EYES [[BLEED]] FROM THEIR SOCKETS! <br /><br />Crap. Crap. Crap.","Dude...I [[Mliked]] Buffy and Angel as much as the [[net]] [[scif-i]] freak...but this is too much. The worst lead [[atress]] [[BEVER]]!! Not even David ""Hot Pants"" Boreanaz is able to save this crap. No [[ownder]] I NEVER watch [[Fxo]]  it blows!! [[Wse]] totally [[cave]] it a [[cance]], and it [[cpontinued]] to suck. We watched [[foNr]] or [[ifve]] painful, agonizing [[epislodes]]. I want to kill the [[exesc]] at the network SO BAD! [[Wyh]] is [[monXy]] being spent on this [[dMivel]]?!?! I don't get it and I don't support it and you should [[NVEER]] waste your [[tme]] watching this show...unless you [[ILKE]] it when your EYES [[BHEED]] FROM THEIR SOCKETS! <br /><br />Crap. Crap. Crap.",0.00020259618759155273,0.0004493594169616699,0,0,0,217,"Failed"
