"original_text","perturbed_text","original_score","perturbed_score","original_output","perturbed_output","ground_truth_output","num_queries","result_type"
"A [[typical]] [[Goth]] chick (Rainbow [[Harvest]] looking like a cross between Winona Ryder in Beetlejuice and Boy George) gets even with people she feels have wronged her with the help of an old haunted mirror that she finds in the new house she and her mom (horror [[mainstay]], Karen [[Black]], the only remotely [[good]] thing about this [[travesty]]) buy. [[The]] [[acting's]] [[pretty]] laughably bad (especially when [[Rainbow]] interacts with the aforementioned mirror) and there are no scares or suspense to be had. [[This]] film [[inexplicably]] spawned thus for 3 [[sequels]] each slightly more [[atrocious]] than the last. [[People]] looking for a similarly themed, but far superior cinematic endeavor would be well [[advised]] to just search out the episode of ""Friday the 13th: the Series"" where a geeky girl finds an old cursed compact mirror. That [[packs]] more chills in it's [[scant]] 40 minutes than this [[whole]] [[franchise]] has [[provided]] across it's 4 films.<br /><br />My Grade: D <br /><br />Eye [[Candy]]: Charlie Spradling provides the obligatory T&A","A [[typial]] [[Got]] chick (Rainbow [[HSarvest]] looking like a cross between Winona Ryder in Beetlejuice and Boy George) gets even with people she feels have wronged her with the help of an old haunted mirror that she finds in the new house she and her mom (horror [[mainstya]], Karen [[BlaVk]], the only remotely [[god]] thing about this [[travsty]]) buy. [[ThK]] [[actnig's]] [[prety]] laughably bad (especially when [[aRinbow]] interacts with the aforementioned mirror) and there are no scares or suspense to be had. [[HThis]] film [[ienxplicably]] spawned thus for 3 [[sqeuels]] each slightly more [[tarocious]] than the last. [[tPeople]] looking for a similarly themed, but far superior cinematic endeavor would be well [[adviseZ]] to just search out the episode of ""Friday the 13th: the Series"" where a geeky girl finds an old cursed compact mirror. That [[paHks]] more chills in it's [[scnt]] 40 minutes than this [[whoe]] [[franhcise]] has [[providrd]] across it's 4 films.<br /><br />My Grade: D <br /><br />Eye [[LCandy]]: Charlie Spradling provides the obligatory T&A",0.00014925003051757812,0.0002829432487487793,0,0,0,219,"Failed"
"[[This]] [[feels]] [[like]] a feature-lenght treatment of a comedy-routine that could have also been told in a ten-minute short. Also, technical credits are [[sup-par]]. The film really [[feels]] like a film [[school]] [[diploma]] [[project]].<br /><br />The [[cast]] is a mix of seasoned stage pros and talented newcomers but the problems is the [[superficial]] [[scrip]]. Their [[lines]] feel constructed, exactly like [[cued]] TV [[show]] [[material]].<br /><br />The [[director]] [[fails]] to take his protagonists [[seriously]], therefore we are not [[touched]] by their problems and conflicts.<br /><br />The film has been cleverly marketed and offers a unique selling [[point]], but in the [[end]] the [[film]] [[disappoints]] on all [[levels]].","[[Thiu]] [[feelcs]] [[lKke]] a feature-lenght treatment of a comedy-routine that could have also been told in a ten-minute short. Also, technical credits are [[sIup-par]]. The film really [[feela]] like a film [[schoo]] [[dipoma]] [[projcet]].<br /><br />The [[acst]] is a mix of seasoned stage pros and talented newcomers but the problems is the [[supefricial]] [[sucrip]]. Their [[lnes]] feel constructed, exactly like [[cSed]] TV [[shPw]] [[mateiral]].<br /><br />The [[direcotr]] [[fais]] to take his protagonists [[seriusly]], therefore we are not [[ouched]] by their problems and conflicts.<br /><br />The film has been cleverly marketed and offers a unique selling [[pont]], but in the [[edn]] the [[fim]] [[disYappoints]] on all [[levsels]].",0.0001755356788635254,0.20644515752792358,0,0,0,185,"Failed"
"A 'Wes Craven presents' movie from 1995, directed by Joe Clayton and starring Lance Henriksen. A group of scientists save a dying man they find by their desert stranded government outpost by injecting him with their experimental virus, of course, one of their colleagues goes overboard and the virus transforms the man into a near unstoppable monster with them trapped inside. Lance Henriksen plays the morally offended researcher who leaves the project before all this, but returns after receiving a call for help to save the man (pre-unstoppable death machine mutation).<br /><br />Deciding to combine two trips in one he brings his family along with him (they're going on vacation afterwards) and proceeds to give them entry to the top secret government facility, thus putting them right in the middle of the chaos within. In case you can't tell, this one relies on the viewer to work with it a little and put aside some petty (see: major and blatant) details.<br /><br />Overall though: Watch-able with [[mild]] bits of enjoyment. Note: The Outpost is commonly known under the title 'Mind Ripper'","A 'Wes Craven presents' movie from 1995, directed by Joe Clayton and starring Lance Henriksen. A group of scientists save a dying man they find by their desert stranded government outpost by injecting him with their experimental virus, of course, one of their colleagues goes overboard and the virus transforms the man into a near unstoppable monster with them trapped inside. Lance Henriksen plays the morally offended researcher who leaves the project before all this, but returns after receiving a call for help to save the man (pre-unstoppable death machine mutation).<br /><br />Deciding to combine two trips in one he brings his family along with him (they're going on vacation afterwards) and proceeds to give them entry to the top secret government facility, thus putting them right in the middle of the chaos within. In case you can't tell, this one relies on the viewer to work with it a little and put aside some petty (see: major and blatant) details.<br /><br />Overall though: Watch-able with [[mqild]] bits of enjoyment. Note: The Outpost is commonly known under the title 'Mind Ripper'",0.0016493797302246094,0.9526932239532471,0,1,0,121,"Successful"
"Elegance and class are not always the first words that come to mind when folks (at least folks who might do such a thing) sit around and talk about film noir. <br /><br />Yet some of the best films of the genre, ""Out of the Past,"" ""The Killers,"" ""In A Lonely Place,"" ""Night and the City,"" manage a level of sleek sophistication that elevates them beyond a moody catch phrase and its connotations of foreboding shadows, fedoras, and femme-fatales. <br /><br />""Where the Sidewalk Ends,"" a fairly difficult to find film -- the only copy in perhaps the best stocked video store in Manhattan was a rough bootleg from the AMC cable channel -- belongs in a category with these [[classics]].<br /><br />From the moment the black cloud of opening credits pass, a curtain is drawing around rogue loner detective Marc Dixon's crumbling world, and as the moments pass, it inches ever closer, threatening suffocation. <br /><br />Sure, he's that familiar ""cop with a dark past"", but Dana Andrews gives Dixon a bleak stare and troubled intensity that makes you as uncomfortable as he seems. And yeah, he's been smacking around suspects for too long, and the newly promoted chief (Karl Malden, in a typically robust and commanding outing) is warning him ""for the last time."" <br /><br />Yet Dixon hates these [[thugs]] too much to stop now. And boy didn't they had have it coming? <br /><br />""Hoods, dusters, mugs, gutter nickel-rats"" he spits when that tough nut of a boss demotes him and rolls out all of the complaints the bureau has been receiving about Dixon's right hook. The advice is for him to cool off for his own good. But instead he takes matters into his own hands. <br /><br />And what a world of trouble he finds when he relies on his instincts, and falls back on a [[nature]] that may or may not have been passed down from a generation before. <br /><br />Right away he's in deep with the cops, the syndicate, his own partner. Dixon's questionable involvement in a murder ""investigation"" threatens his job, makes him wonder whether he is simply as base as those he has sworn to bring in. Like Bogart in ""Lonely Place,"" can he ""escape what he is?""<br /><br />When he has nowhere else to turn, he discovers that he has virtually doomed his unexpected relationship with a seraphic beauty (the marvelous Gene Tierney) who seems as if she can turn his barren bachelor's existence into something worth coming home to. <br /><br />The pacing of this superb film is taut and gripping. The group of writers that contributed to the production polished the script to a high gloss -- the dialogue is snappy without disintegrating into dated parody fodder, passionate without becoming melodramatic or sappy. <br /><br />And all of this top-notch direction and acting isn't too slick or buffed to loosen the film's emotional hold. Gene Tierney's angelic, soft-focus beauty is used to great effect. She shows herself to be an actress of considerable range, and her gentle, kind nature is as boundless here as is her psychosis in ""Leave Her to Heaven."" The scenes between Tierney and Andrews's Dixon grow more intense and touching the closer he seems to self-destruction. <br /><br />Near the end of his rope, cut, bruised, and exhausted Dixon summarizes his lot: ""Innocent people can get into terrible jams, too,.."" he says. ""One false move and you're in over your head."" <br /><br />Perhaps what makes this film so totally compelling is the sense that things could go wildly wrong for almost anyone -- especially for someone who is trying so hard to do right -- with one slight shift in the wind, one wrong decision or punch, or, most frighteningly, due to factors you have no control over. Noir has always reflected the darkest fears, brought them to the surface. ""Where the Sidewalk Ends"" does so in a realistic fashion. <br /><br />(One nit-pick of an aside: This otherwise sterling film has a glaringly poor dub of a blonde model that wouldn't seem out of place on Mystery Science Theater. How very odd.) <br /><br />But Noir fans -- heck, ANY movie fans -- who haven't seen this one are in for a terrific treat.","Elegance and class are not always the first words that come to mind when folks (at least folks who might do such a thing) sit around and talk about film noir. <br /><br />Yet some of the best films of the genre, ""Out of the Past,"" ""The Killers,"" ""In A Lonely Place,"" ""Night and the City,"" manage a level of sleek sophistication that elevates them beyond a moody catch phrase and its connotations of foreboding shadows, fedoras, and femme-fatales. <br /><br />""Where the Sidewalk Ends,"" a fairly difficult to find film -- the only copy in perhaps the best stocked video store in Manhattan was a rough bootleg from the AMC cable channel -- belongs in a category with these [[cUassics]].<br /><br />From the moment the black cloud of opening credits pass, a curtain is drawing around rogue loner detective Marc Dixon's crumbling world, and as the moments pass, it inches ever closer, threatening suffocation. <br /><br />Sure, he's that familiar ""cop with a dark past"", but Dana Andrews gives Dixon a bleak stare and troubled intensity that makes you as uncomfortable as he seems. And yeah, he's been smacking around suspects for too long, and the newly promoted chief (Karl Malden, in a typically robust and commanding outing) is warning him ""for the last time."" <br /><br />Yet Dixon hates these [[htugs]] too much to stop now. And boy didn't they had have it coming? <br /><br />""Hoods, dusters, mugs, gutter nickel-rats"" he spits when that tough nut of a boss demotes him and rolls out all of the complaints the bureau has been receiving about Dixon's right hook. The advice is for him to cool off for his own good. But instead he takes matters into his own hands. <br /><br />And what a world of trouble he finds when he relies on his instincts, and falls back on a [[ntaure]] that may or may not have been passed down from a generation before. <br /><br />Right away he's in deep with the cops, the syndicate, his own partner. Dixon's questionable involvement in a murder ""investigation"" threatens his job, makes him wonder whether he is simply as base as those he has sworn to bring in. Like Bogart in ""Lonely Place,"" can he ""escape what he is?""<br /><br />When he has nowhere else to turn, he discovers that he has virtually doomed his unexpected relationship with a seraphic beauty (the marvelous Gene Tierney) who seems as if she can turn his barren bachelor's existence into something worth coming home to. <br /><br />The pacing of this superb film is taut and gripping. The group of writers that contributed to the production polished the script to a high gloss -- the dialogue is snappy without disintegrating into dated parody fodder, passionate without becoming melodramatic or sappy. <br /><br />And all of this top-notch direction and acting isn't too slick or buffed to loosen the film's emotional hold. Gene Tierney's angelic, soft-focus beauty is used to great effect. She shows herself to be an actress of considerable range, and her gentle, kind nature is as boundless here as is her psychosis in ""Leave Her to Heaven."" The scenes between Tierney and Andrews's Dixon grow more intense and touching the closer he seems to self-destruction. <br /><br />Near the end of his rope, cut, bruised, and exhausted Dixon summarizes his lot: ""Innocent people can get into terrible jams, too,.."" he says. ""One false move and you're in over your head."" <br /><br />Perhaps what makes this film so totally compelling is the sense that things could go wildly wrong for almost anyone -- especially for someone who is trying so hard to do right -- with one slight shift in the wind, one wrong decision or punch, or, most frighteningly, due to factors you have no control over. Noir has always reflected the darkest fears, brought them to the surface. ""Where the Sidewalk Ends"" does so in a realistic fashion. <br /><br />(One nit-pick of an aside: This otherwise sterling film has a glaringly poor dub of a blonde model that wouldn't seem out of place on Mystery Science Theater. How very odd.) <br /><br />But Noir fans -- heck, ANY movie fans -- who haven't seen this one are in for a terrific treat.",0.0004801750183105469,0.9912019371986389,1,0,1,427,"Successful"
"I liked this a lot. [[In]] [[fact]], if I see it again(and I plan to) I just may love it. I'll echo other reviewers in saying that this movie really does grow on you as you watch. It [[starts]] kind of slowly but the way in enfolds is very natural and has a mood to it. [[You]] just get into it.<br /><br />I really liked the [[summery]] atmosphere to the movie and thought the movie was very touching as a [[whole]]. The characters have a strong element of realism and the movie very slowly and gently [[weaves]] a spell as you get [[involved]] in the [[various]] [[interactions]] between them all and [[want]] to know how it will ultimately turn out and what [[paths]] the characters will choose to take. <br /><br />I am very surprised that there are less then a [[dozen]] comments on [[this-there]] are obscure TV movies that have more comments then Rich In Love.<br /><br />One thing that I will say is I missed the ending which is driving me crazy and I HAVE to watch it again to see that. This is a movie that [[may]] not be for everybody but that I feel is strongly underrated(even some of my most [[film]] buff [[purist]] friends who have seen almost [[every]] movie there is haven't seen this) and it doesn't even seem to have much of a [[message]] board but I liked it a lot and to all those who like [[family]] dramas that are [[warm]] on scenery, atmosphere and an unhurried languid pace should probably take a look at this. Especially note worthy is that it takes [[place]] in South [[Carolina]] so for those (like me) who love the south, and movies that take place there, this is a gem. I'll add my [[vote]] to the [[woefully]] few comments and recommend this little known flick.","I liked this a lot. [[IP]] [[facst]], if I see it again(and I plan to) I just may love it. I'll echo other reviewers in saying that this movie really does grow on you as you watch. It [[sarts]] kind of slowly but the way in enfolds is very natural and has a mood to it. [[Yuo]] just get into it.<br /><br />I really liked the [[sumery]] atmosphere to the movie and thought the movie was very touching as a [[whAle]]. The characters have a strong element of realism and the movie very slowly and gently [[weavs]] a spell as you get [[ivnolved]] in the [[vakrious]] [[interacttions]] between them all and [[wdnt]] to know how it will ultimately turn out and what [[pagths]] the characters will choose to take. <br /><br />I am very surprised that there are less then a [[doze]] comments on [[this-theere]] are obscure TV movies that have more comments then Rich In Love.<br /><br />One thing that I will say is I missed the ending which is driving me crazy and I HAVE to watch it again to see that. This is a movie that [[my]] not be for everybody but that I feel is strongly underrated(even some of my most [[iflm]] buff [[puryst]] friends who have seen almost [[eveyr]] movie there is haven't seen this) and it doesn't even seem to have much of a [[mesage]] board but I liked it a lot and to all those who like [[famiPly]] dramas that are [[wamr]] on scenery, atmosphere and an unhurried languid pace should probably take a look at this. Especially note worthy is that it takes [[plce]] in South [[JCarolina]] so for those (like me) who love the south, and movies that take place there, this is a gem. I'll add my [[vot]] to the [[Loefully]] few comments and recommend this little known flick.",0.00013935565948486328,0.00026351213455200195,1,1,1,297,"Failed"
"I watched the world premiere of this on the Starz Action channel. They call it Vampires: The Turning. The plot was a little confusing. There is a voice-over in the introduction about an 800 year war, and I didn't quite understand. The movie is about a young couple somewhere in Asia (maybe in China, I don't think the movie specifies). The couple has an argument and Meredith Monroe runs off and is kidnapped by a biker gang of Vampires. The boyfriend finds a group of vampires that don't kill humans, and enters into a battle with the bikers. A human group of slayers somehow get involved, and the final fight sequence takes place during a solar eclipse. This movie is not related to either Vampires or Vampires: Los Muertos. Confusing, but decent action. Four out of 10 stars.","I watched the world premiere of this on the Starz Action channel. They call it Vampires: The Turning. The plot was a little confusing. There is a voice-over in the introduction about an 800 year war, and I didn't quite understand. The movie is about a young couple somewhere in Asia (maybe in China, I don't think the movie specifies). The couple has an argument and Meredith Monroe runs off and is kidnapped by a biker gang of Vampires. The boyfriend finds a group of vampires that don't kill humans, and enters into a battle with the bikers. A human group of slayers somehow get involved, and the final fight sequence takes place during a solar eclipse. This movie is not related to either Vampires or Vampires: Los Muertos. Confusing, but decent action. Four out of 10 stars.",0.9980137348175049,0.9980137348175049,1,1,0,1,"Skipped"
"After some difficulty, Johnny Yuma arrives at his ailing uncle's ranch to take over day to day operations, only to find out that the old man has been murdered by his beautiful gold-digger wife and the woman's vicious brother.<br /><br />Good production values, a [[likable]] [[performance]] by Mark Damon, and a breezy action [[packed]] [[script]] [[combine]] to make this an entertaining, if not exceptionally [[deep]], above average [[addition]] to the spaghetti western genre.<br /><br />Co-star Rosalba Neri is [[one]] of the hottest European babes ever to grace the screen. Here she's absolutely [[perfect]] as the cold-hearted user (and abuser) of weak men.<br /><br />Damon and Neri appeared together in at least one other picture, The [[Devil's]] Wedding Night, a pretty [[good]] horror movie [[that's]] of particular interest for those of you that want to see what's underneath Rosalba's dresses.","After some difficulty, Johnny Yuma arrives at his ailing uncle's ranch to take over day to day operations, only to find out that the old man has been murdered by his beautiful gold-digger wife and the woman's vicious brother.<br /><br />Good production values, a [[ikable]] [[perofrmance]] by Mark Damon, and a breezy action [[pcked]] [[sQript]] [[ocmbine]] to make this an entertaining, if not exceptionally [[ddeep]], above average [[adidtion]] to the spaghetti western genre.<br /><br />Co-star Rosalba Neri is [[noe]] of the hottest European babes ever to grace the screen. Here she's absolutely [[perfnct]] as the cold-hearted user (and abuser) of weak men.<br /><br />Damon and Neri appeared together in at least one other picture, The [[Devi'ls]] Wedding Night, a pretty [[goKd]] horror movie [[htat's]] of particular interest for those of you that want to see what's underneath Rosalba's dresses.",0.0003795623779296875,0.9142377376556396,1,0,1,140,"Successful"
"What a waste of a great cast. Figured I'd [[check]] it out because it [[looked]] [[like]] a good [[stoner]] comedy with a [[lot]] of fairly well-known [[actors]]. What it turned out to be was a pointless collection of [[boring]] intertwining stories about several characters with [[minimal]] connections with each other. Characters who [[start]] off looking [[like]] decent people but [[end]] up with not a [[single]] [[likable]] or interesting [[characteristic]] [[among]] them. Calling it a comedy was a [[stretch]] as well...the only thing that [[made]] me [[chuckle]] was Jack [[Black's]] song, which was basically Tenacious D. I waited for [[something]] big to [[happen]] but ended up with [[nothing]] more than 97 [[minutes]] of my life [[wasted]].","What a waste of a great cast. Figured I'd [[checCk]] it out because it [[looed]] [[ike]] a good [[stoQner]] comedy with a [[hlot]] of fairly well-known [[atcors]]. What it turned out to be was a pointless collection of [[bowing]] intertwining stories about several characters with [[minmal]] connections with each other. Characters who [[stat]] off looking [[ike]] decent people but [[ed]] up with not a [[singe]] [[jikable]] or interesting [[charactersitic]] [[amnog]] them. Calling it a comedy was a [[stretcd]] as well...the only thing that [[mdae]] me [[cuckle]] was Jack [[qlack's]] song, which was basically Tenacious D. I waited for [[somtehing]] big to [[happez]] but ended up with [[snothing]] more than 97 [[mintues]] of my life [[wajsted]].",0.0001634359359741211,0.00028759241104125977,0,0,0,225,"Failed"
"When I [[first]] saw this film around 6 months ago, I considered it interesting, but little more. But it stuck with me. That interest grew and [[grew]], and I wondered whether my [[initial]] boredom and [[response]] had more to do with the actual [[VHS]] quality rather than the film itself. I [[purchased]] the [[Criterion]] DVD box set, and it turns out that I was right the second time. Alexander Nevsky is a great film. It is [[rousing]], and I'm sure it succeeded in its main [[aim]]: propaganda against the [[Germans]].<[[br]] /><[[br]] />That is the most common [[criticism]] against this film, and against Eisenstein, that it is merely propagandist and nothing else. It's untrue. He is an amazing film artist, one of the most important [[whoever]] [[lived]]. By now, the world is [[far]] [[enough]] beyond Joseph Stalin to be able to [[watch]] Eisenstein's [[films]] as art.","When I [[ifrst]] saw this film around 6 months ago, I considered it interesting, but little more. But it stuck with me. That interest grew and [[rgew]], and I wondered whether my [[iniial]] boredom and [[aresponse]] had more to do with the actual [[HS]] quality rather than the film itself. I [[purchasled]] the [[Critrion]] DVD box set, and it turns out that I was right the second time. Alexander Nevsky is a great film. It is [[rFousing]], and I'm sure it succeeded in its main [[aig]]: propaganda against the [[Gemans]].<[[rb]] /><[[rb]] />That is the most common [[criYicism]] against this film, and against Eisenstein, that it is merely propagandist and nothing else. It's untrue. He is an amazing film artist, one of the most important [[hwoever]] [[lievd]]. By now, the world is [[afr]] [[enorgh]] beyond Joseph Stalin to be able to [[wutch]] Eisenstein's [[filmG]] as art.",0.0002650618553161621,0.5358948707580566,1,0,1,198,"Successful"
