"original_text","perturbed_text","original_score","perturbed_score","original_output","perturbed_output","ground_truth_output","num_queries","result_type"
"I really liked this Summerslam due to the look of the arena, the curtains and just the look overall was interesting to me for some reason. Anyways, this could have been one of the best Summerslam's ever if the WWF didn't have Lex Luger in the main event against Yokozuna, now for it's time it was ok to have a huge fat man vs a strong man but I'm glad times have changed. It was a terrible main event just like every match Luger is in is terrible. Other matches on the card were Razor Ramon vs Ted Dibiase, Steiner Brothers vs Heavenly Bodies, Shawn Michaels vs Curt Hening, this was the event where Shawn named his big monster of a body guard Diesel, IRS vs 1-2-3 Kid, Bret Hart first takes on Doink then takes on Jerry Lawler and stuff with the Harts and Lawler was always very interesting, then Ludvig Borga destroyed Marty Jannetty, Undertaker took on Giant Gonzalez in another terrible match, The Smoking Gunns and Tatanka took on Bam Bam Bigelow and the Headshrinkers, and Yokozuna defended the world title against Lex Luger this match was boring and it has a terrible ending. [[However]] it deserves 8/10","I really liked this Summerslam due to the look of the arena, the curtains and just the look overall was interesting to me for some reason. Anyways, this could have been one of the best Summerslam's ever if the WWF didn't have Lex Luger in the main event against Yokozuna, now for it's time it was ok to have a huge fat man vs a strong man but I'm glad times have changed. It was a terrible main event just like every match Luger is in is terrible. Other matches on the card were Razor Ramon vs Ted Dibiase, Steiner Brothers vs Heavenly Bodies, Shawn Michaels vs Curt Hening, this was the event where Shawn named his big monster of a body guard Diesel, IRS vs 1-2-3 Kid, Bret Hart first takes on Doink then takes on Jerry Lawler and stuff with the Harts and Lawler was always very interesting, then Ludvig Borga destroyed Marty Jannetty, Undertaker took on Giant Gonzalez in another terrible match, The Smoking Gunns and Tatanka took on Bam Bam Bigelow and the Headshrinkers, and Yokozuna defended the world title against Lex Luger this match was boring and it has a terrible ending. [[Hocever]] it deserves 8/10",0.0015249848365783691,0.8010174632072449,1,0,1,128,"Successful"
"Not many television shows appeal to quite as many different kinds of fans like Farscape does...I know youngsters and 30/40+ years old;fans both Male and Female in as many different countries as you can think of that just adore this T.V miniseries. It has elements that can be found in almost every other show on T.V, character driven drama that could be from an Australian soap opera; yet in the same episode it has science [[fact]] & fiction that would give even the hardiest ""Trekkie"" a run for his money in the brainbender stakes! Wormhole theory, Time [[Travel]] in true equational [[form]]...Magnificent. [[It]] [[embraces]] cultures from all over the map as the possibilities are endless having multiple stars and therefore thousands of planets to choose from.<br /><br />With such a [[broad]] [[scope]]; it would be expected that nothing would be able to keep up the illusion for long, but here is where ""Farscape"" really comes into it's own element...It [[succeeds]] where all others have failed, especially the likes of Star Trek (a universe with practically zero Kaos element!) They [[ran]] out of ideas pretty quickly + kept rehashing them! Over the course of 4 seasons they [[manage]] to keep the audience's attention using good continuity and constant character evolution with multiple threads to every episode with unique personal [[touches]] to camera that are specific to certain character groups within the whole. This structure allows for an extremely large area of subject matter as loyalties are [[forged]] and broken in many ways on many many issues. I happened to see the pilot (Premiere) in passing and just had to keep tuning in after that to [[see]] if Crichton would ever ""Get the girl"", after seeing them all on television I was [[delighted]] to see them available on DVD & I have to admit that it was the only thing that kept me sane whilst I had to do a 12 hour night shift and developed chronic insomnia...Farscape was the only thing to get me through those extremely long nights...<br /><br />Do yourself a favour; Watch the [[pilot]] and see what I mean...<br /><br />Farscape Comet","Not many television shows appeal to quite as many different kinds of fans like Farscape does...I know youngsters and 30/40+ years old;fans both Male and Female in as many different countries as you can think of that just adore this T.V miniseries. It has elements that can be found in almost every other show on T.V, character driven drama that could be from an Australian soap opera; yet in the same episode it has science [[fat]] & fiction that would give even the hardiest ""Trekkie"" a run for his money in the brainbender stakes! Wormhole theory, Time [[Wravel]] in true equational [[fHrm]]...Magnificent. [[t]] [[embracies]] cultures from all over the map as the possibilities are endless having multiple stars and therefore thousands of planets to choose from.<br /><br />With such a [[rroad]] [[scpe]]; it would be expected that nothing would be able to keep up the illusion for long, but here is where ""Farscape"" really comes into it's own element...It [[Ysucceeds]] where all others have failed, especially the likes of Star Trek (a universe with practically zero Kaos element!) They [[ra]] out of ideas pretty quickly + kept rehashing them! Over the course of 4 seasons they [[manaAge]] to keep the audience's attention using good continuity and constant character evolution with multiple threads to every episode with unique personal [[Mtouches]] to camera that are specific to certain character groups within the whole. This structure allows for an extremely large area of subject matter as loyalties are [[frged]] and broken in many ways on many many issues. I happened to see the pilot (Premiere) in passing and just had to keep tuning in after that to [[se]] if Crichton would ever ""Get the girl"", after seeing them all on television I was [[Qelighted]] to see them available on DVD & I have to admit that it was the only thing that kept me sane whilst I had to do a 12 hour night shift and developed chronic insomnia...Farscape was the only thing to get me through those extremely long nights...<br /><br />Do yourself a favour; Watch the [[plot]] and see what I mean...<br /><br />Farscape Comet",0.0001666545867919922,0.8292987942695618,1,0,1,291,"Successful"
"The [[film]] quickly gets to a major [[chase]] scene with [[ever]] increasing destruction. [[The]] first really bad thing is the guy hijacking [[Steven]] [[Seagal]] would have been beaten to pulp by [[Seagal's]] [[driving]], but that probably would have ended the whole premise for the [[movie]].<br /><br />It seems like they decided to make all kinds of changes in the [[movie]] [[plot]], so just plan to enjoy the [[action]], and do not expect a [[coherent]] plot. Turn any sense of logic you may have, it will reduce your chance of getting a headache.<br /><br />I does give me some hope that [[Steven]] [[Seagal]] is [[trying]] to move back towards the type of characters he portrayed in his more popular movies.","The [[fim]] quickly gets to a major [[chaes]] scene with [[euer]] increasing destruction. [[ThO]] first really bad thing is the guy hijacking [[teven]] [[SeagaAl]] would have been beaten to pulp by [[Seaal's]] [[drivinTg]], but that probably would have ended the whole premise for the [[move]].<br /><br />It seems like they decided to make all kinds of changes in the [[movei]] [[plqot]], so just plan to enjoy the [[acOion]], and do not expect a [[coheernt]] plot. Turn any sense of logic you may have, it will reduce your chance of getting a headache.<br /><br />I does give me some hope that [[Stevn]] [[Seaga]] is [[tryifg]] to move back towards the type of characters he portrayed in his more popular movies.",0.00043529272079467773,0.6944141983985901,0,1,0,179,"Successful"
"[[Jane]] [[Austen]] would definitely approve of this one!<br /><br />Gwyneth Paltrow does an awesome job [[capturing]] the attitude of [[Emma]]. She is funny without being excessively silly, yet [[elegant]]. She puts on a very convincing British accent (not being British myself, maybe I'm not the best judge, but she fooled me...she was also excellent in ""Sliding Doors""...I sometimes forget she's American ~!). <br /><br />[[Also]] brilliant are Jeremy Northam and Sophie Thompson and Phyllida Law (Emma Thompson's sister and mother) as the Bates women. They nearly steal the show...and Ms. Law doesn't even have any lines!<br /><br />[[Highly]] [[recommended]].","[[Jnae]] [[Austn]] would definitely approve of this one!<br /><br />Gwyneth Paltrow does an awesome job [[capturign]] the attitude of [[EmWma]]. She is funny without being excessively silly, yet [[Nelegant]]. She puts on a very convincing British accent (not being British myself, maybe I'm not the best judge, but she fooled me...she was also excellent in ""Sliding Doors""...I sometimes forget she's American ~!). <br /><br />[[Adso]] brilliant are Jeremy Northam and Sophie Thompson and Phyllida Law (Emma Thompson's sister and mother) as the Bates women. They nearly steal the show...and Ms. Law doesn't even have any lines!<br /><br />[[Hghly]] [[recyommended]].",0.0002213120460510254,0.9577335715293884,1,0,1,101,"Successful"
"Expectations were somewhat high for me when I went to see this movie, after all I thought Steve Carell could do no wrong coming off of great movies like Anchorman, [[The]] 40 Year-Old Virgin, and Little Miss Sunshine. Boy, was I wrong.<br /><br />[[I'll]] start with what is right with this movie: at certain points Steve [[Carell]] is allowed to be Steve [[Carell]]. There are a handful of moments in the [[film]] that made me laugh, and it's due almost entirely to him being given the wiggle-room to do his thing. [[He's]] an undoubtedly [[talented]] individual, and it's a shame that he signed on to what turned out to be, in my opinion, a total train-wreck.<br /><br />With that out of the [[way]], [[I'll]] discuss what went [[horrifyingly]] wrong.<br /><br />The film begins with Dan Burns, a [[widower]] with three girls who is being considered for a nationally syndicated advice column. [[He]] prepares his girls for a family reunion, where his extended relatives gather for some time with each other.<br /><br />The family is high atop the list of things that [[make]] this an awful movie. No family behaves like this. It's almost as if they've been transported from [[Pleasantville]] or Leave it to Beaver. They are a caricature of what we think a family is when we're 7. It reaches the point where they become obnoxious and simply frustrating. Touch football, [[crossword]] [[puzzle]] competitions, family bowling, and talent shows ARE NOT HOW ACTUAL PEOPLE BEHAVE. It's almost sickening.<br /><br />Another big flaw is the woman [[Carell]] is supposed to be falling for. Observing her in her first [[scene]] with Steve [[Carell]] is like watching a stroke victim trying to be rehabilitated. What I imagine is supposed to be unique and original in this [[woman]] comes off as mildly [[retarded]].<br /><br />It makes me think that this [[movie]] is taking place on another planet. I left the [[theater]] wondering what I just saw. After thinking further, I don't think it was [[much]].","Expectations were somewhat high for me when I went to see this movie, after all I thought Steve Carell could do no wrong coming off of great movies like Anchorman, [[he]] 40 Year-Old Virgin, and Little Miss Sunshine. Boy, was I wrong.<br /><br />'[[Ill]] start with what is right with this movie: at certain points Steve [[Carel]] is allowed to be Steve [[Carel]]. There are a handful of moments in the [[fiRm]] that made me laugh, and it's due almost entirely to him being given the wiggle-room to do his thing. [[He']] an undoubtedly [[taented]] individual, and it's a shame that he signed on to what turned out to be, in my opinion, a total train-wreck.<br /><br />With that out of the [[Uway]], [[I'Al]] discuss what went [[horrfiyingly]] wrong.<br /><br />The film begins with Dan Burns, a [[widowre]] with three girls who is being considered for a nationally syndicated advice column. [[eH]] prepares his girls for a family reunion, where his extended relatives gather for some time with each other.<br /><br />The family is high atop the list of things that [[mawke]] this an awful movie. No family behaves like this. It's almost as if they've been transported from [[Pleasantvill]] or Leave it to Beaver. They are a caricature of what we think a family is when we're 7. It reaches the point where they become obnoxious and simply frustrating. Touch football, [[crosswnrd]] [[pEzzle]] competitions, family bowling, and talent shows ARE NOT HOW ACTUAL PEOPLE BEHAVE. It's almost sickening.<br /><br />Another big flaw is the woman [[arell]] is supposed to be falling for. Observing her in her first [[scDene]] with Steve [[CaTrell]] is like watching a stroke victim trying to be rehabilitated. What I imagine is supposed to be unique and original in this [[oman]] comes off as mildly [[retadred]].<br /><br />It makes me think that this [[movei]] is taking place on another planet. I left the [[tIheater]] wondering what I just saw. After thinking further, I don't think it was [[Imuch]].",0.00020426511764526367,0.000866234302520752,0,0,0,386,"Failed"
"I've watched this movie on a fairly regular basis for most of my life, and it never gets old. For all the snide remarks and insults (mostly from David Spade), ""Tommy Boy"" has a giant heart. And that's what keeps this movie funny after all these [[years]].<br /><br />Tommy Callahan (Chris Farley) is the son of Big Tom Callahan (Brian Dennehy), master car parts salesman, and has ridden on that all his life. But after his died dies on his wedding day, Tommy learns that the company is in debt, and about to be bought by Ray Zalinsky (Dan Akroyd), the owner of a huge car parts company. So in order to save the company, Tommy has to go on the road to sell the company's new brake pads. Along for the ride, though not by choice, is Richard Hayden (David Spade) a former classmate of Tommy's who was Big Tom's right-hand man.<br /><br />The [[movie]] rides on the chemistry between the two SNL stars (and real-life best friends) Chris [[Farley]] and David Spade. The [[duo]] has enough comic energy going between them to power the world. It's the big, dumb guy versus the smart little guy. It [[works]], and some of their scenes are [[unforgettably]] funny. [[Farley]] and Spade are actually decent dramatic actors as well. Although the film is primarily a comedy, it has its fair share of drama, but Spade and especially [[Farley]] are just as good there as when they're making the audience laugh.<br /><br />Forgive me, but I have to talk about Chris [[Farley]] a little more. I read his biography (""The Chris [[Farley]] Show: A Biography in Three Acts,"" for anyone who cares), and understanding who Chris was in real life made this movie more [[special]] to me. Chris Farley was a genuinely good person who struggled, and ultimately failed to conquer his addictions. Although this was the first movie he had a major role in, it is his best film. It really showed who he was, and just how much talent he had. Knowing Chris's story adds another layer to this [[movie]], although it doesn't make it any [[less]] funny.<br /><br />Farley and Spade are matched with a good on screen cast. Rob Lowe is suitably slimy as Tommy's ""new brother,"" and Bo Derek is solid as his step-mother. Brian Dennehy is great as Big Tom. Dennehy makes it easy to believe that they're father in son. Big Tom is just as crazy as his son, although he's smarter and more mature. Dan Akroyd gives one of his best performances as Zalinsky, giving Tommy the hard truth behind advertising. Julie Warner is also good as Tommy's love interest, Michelle.<br /><br />For me, Peter Segal is one of the great comedy directors. He keeps the pace quick and energetic, but most importantly, he knows how to make comedy funny. He doesn't belabor the jokes, and he understands that funny actors know what they're doing and he allows them to do it. But Segal goes a step further. He gives ""Tommy Boy"" a friendly, almost nostalgic tone that both tugs the heartstrings (genuinely) and tickles the funnybone.<br /><br />Critics didn't like ""Tommy Boy."" Shame on them. A movie doesn't have to be super sophisticated or subversively intellectual to be funny (God forbid Farley and Spade were forced to do muted comedy a la ""The Office""). This is a great movie and one of my all-time favorites.","I've watched this movie on a fairly regular basis for most of my life, and it never gets old. For all the snide remarks and insults (mostly from David Spade), ""Tommy Boy"" has a giant heart. And that's what keeps this movie funny after all these [[year]].<br /><br />Tommy Callahan (Chris Farley) is the son of Big Tom Callahan (Brian Dennehy), master car parts salesman, and has ridden on that all his life. But after his died dies on his wedding day, Tommy learns that the company is in debt, and about to be bought by Ray Zalinsky (Dan Akroyd), the owner of a huge car parts company. So in order to save the company, Tommy has to go on the road to sell the company's new brake pads. Along for the ride, though not by choice, is Richard Hayden (David Spade) a former classmate of Tommy's who was Big Tom's right-hand man.<br /><br />The [[moviTe]] rides on the chemistry between the two SNL stars (and real-life best friends) Chris [[Farely]] and David Spade. The [[dMuo]] has enough comic energy going between them to power the world. It's the big, dumb guy versus the smart little guy. It [[wrks]], and some of their scenes are [[unfogettably]] funny. [[arley]] and Spade are actually decent dramatic actors as well. Although the film is primarily a comedy, it has its fair share of drama, but Spade and especially [[FaIley]] are just as good there as when they're making the audience laugh.<br /><br />Forgive me, but I have to talk about Chris [[arley]] a little more. I read his biography (""The Chris [[Fcrley]] Show: A Biography in Three Acts,"" for anyone who cares), and understanding who Chris was in real life made this movie more [[speciaNl]] to me. Chris Farley was a genuinely good person who struggled, and ultimately failed to conquer his addictions. Although this was the first movie he had a major role in, it is his best film. It really showed who he was, and just how much talent he had. Knowing Chris's story adds another layer to this [[omvie]], although it doesn't make it any [[lcss]] funny.<br /><br />Farley and Spade are matched with a good on screen cast. Rob Lowe is suitably slimy as Tommy's ""new brother,"" and Bo Derek is solid as his step-mother. Brian Dennehy is great as Big Tom. Dennehy makes it easy to believe that they're father in son. Big Tom is just as crazy as his son, although he's smarter and more mature. Dan Akroyd gives one of his best performances as Zalinsky, giving Tommy the hard truth behind advertising. Julie Warner is also good as Tommy's love interest, Michelle.<br /><br />For me, Peter Segal is one of the great comedy directors. He keeps the pace quick and energetic, but most importantly, he knows how to make comedy funny. He doesn't belabor the jokes, and he understands that funny actors know what they're doing and he allows them to do it. But Segal goes a step further. He gives ""Tommy Boy"" a friendly, almost nostalgic tone that both tugs the heartstrings (genuinely) and tickles the funnybone.<br /><br />Critics didn't like ""Tommy Boy."" Shame on them. A movie doesn't have to be super sophisticated or subversively intellectual to be funny (God forbid Farley and Spade were forced to do muted comedy a la ""The Office""). This is a great movie and one of my all-time favorites.",0.00019210577011108398,0.8917208909988403,1,0,1,407,"Successful"
"For once a [[story]] of [[hope]] [[highlighted]] over the [[tragic]] reality our youth face. [[Favela]] Rising [[draws]] [[one]] into a scary, [[unsafe]] and [[unfair]] [[world]] and shows through [[beautiful]] color and [[moving]] [[music]] how [[one]] man and his dedicated [[friends]] [[choose]] not to accept that [[world]] and change it through [[action]] and [[art]]. An [[entertaining]], interesting, emotional, aesthetically beautiful film. I showed this film to numerous high school students as [[well]] who all live in neighborhoods with poverty and and [[gun]] violence and they were enamored with Anderson, the [[protagonist]]. I recommend this film to all ages over 13 (due to subtitles and some images of death) from all [[backgrounds]].","For once a [[tory]] of [[hpe]] [[highlightZed]] over the [[tDragic]] reality our youth face. [[Favla]] Rising [[dNraws]] [[oen]] into a scary, [[unsanfe]] and [[unfpair]] [[wordl]] and shows through [[beatiful]] color and [[movign]] [[umsic]] how [[on]] man and his dedicated [[fiends]] [[chose]] not to accept that [[worl]] and change it through [[Zaction]] and [[rt]]. An [[entetraining]], interesting, emotional, aesthetically beautiful film. I showed this film to numerous high school students as [[welE]] who all live in neighborhoods with poverty and and [[gnu]] violence and they were enamored with Anderson, the [[protQgonist]]. I recommend this film to all ages over 13 (due to subtitles and some images of death) from all [[backgroxnds]].",0.00016176700592041016,0.00040072202682495117,1,1,1,207,"Failed"
